{
  "$schema": "http://json-schema.org/draft-07/schema#",
  "$id": "https://openinvoicexml.dev/schemas/invoice.schema.json",
  "title": "Invoice",
  "description": "Internal invoice schema v0.1 — single source of truth for all output adapters. Covers mandatory XRechnung / EN 16931 Business Terms. Structural correctness only; business-rule validation (VAT math, BR-Schematron) is handled by a separate validator layer.",
  "type": "object",
  "additionalProperties": false,
  "required": [
    "id",
    "typeCode",
    "issueDate",
    "currencyCode",
    "businessProcessType",
    "seller",
    "buyer",
    "lines",
    "vatBreakdowns",
    "taxExclusiveAmount",
    "taxAmount",
    "taxInclusiveAmount",
    "duePayableAmount"
  ],
  "properties": {
    "id": {
      "type": "string",
      "minLength": 1,
      "description": "BT-1: Invoice number — unique identifier assigned by the seller. Required by EN 16931 and §14 UStG.",
      "maxLength": 500
    },
    "typeCode": {
      "type": "string",
      "enum": ["380", "381", "384"],
      "description": "BT-3: Invoice type code (UNTDID 1001). 380 = commercial invoice, 381 = credit note, 384 = corrective invoice."
    },
    "issueDate": {
      "type": "string",
      "format": "date",
      "description": "BT-2: Invoice issue date (YYYY-MM-DD). Required by §14 Abs. 4 Nr. 3 UStG."
    },
    "dueDate": {
      "type": "string",
      "format": "date",
      "description": "BT-9: Payment due date (YYYY-MM-DD)."
    },
    "currencyCode": {
      "type": "string",
      "pattern": "^[A-Z]{3}$",
      "description": "BT-5: Document currency code (ISO 4217, e.g. EUR). Required by EN 16931."
    },
    "businessProcessType": {
      "type": "string",
      "minLength": 1,
      "description": "BT-23: Business process type identifier. For Peppol: urn:fdc:peppol.eu:2017:poacc:billing:01:1.0",
      "maxLength": 500
    },
    "seller": {
      "allOf": [
        {
          "$ref": "#/$defs/Party"
        },
        {
          "type": "object",
          "required": ["contact"]
        }
      ],
      "description": "BG-4: Seller (invoicing party). Required by §14 Abs. 4 Nr. 1 UStG. Must include contact details (BG-6) per XRechnung rule BR-DE-2."
    },
    "buyer": {
      "$ref": "#/$defs/Party",
      "description": "BG-7: Buyer (invoiced party). Required by §14 Abs. 4 Nr. 1 UStG (full name and address of both supplier and recipient)."
    },
    "lines": {
      "type": "array",
      "minItems": 1,
      "items": {
        "$ref": "#/$defs/InvoiceLine"
      },
      "description": "BG-25: Invoice lines. At least one line is required (XRechnung BR-16)."
    },
    "vatBreakdowns": {
      "type": "array",
      "minItems": 1,
      "items": {
        "$ref": "#/$defs/VatBreakdown"
      },
      "description": "BG-23: VAT breakdown by tax category. At least one entry is required."
    },
    "allowancesCharges": {
      "type": "array",
      "items": {
        "$ref": "#/$defs/AllowanceCharge"
      },
      "description": "BG-20 / BG-21: Document-level allowances (discounts) and charges (surcharges)."
    },
    "taxExclusiveAmount": {
      "type": "number",
      "description": "BT-109: Invoice total amount without VAT (sum of all line amounts). Required by §14 Abs. 4 Nr. 7 UStG."
    },
    "taxAmount": {
      "type": "number",
      "description": "BT-110: Total VAT amount for the invoice. Required by §14 Abs. 4 Nr. 8 UStG."
    },
    "taxInclusiveAmount": {
      "type": "number",
      "description": "BT-112: Invoice total amount with VAT (taxExclusiveAmount + taxAmount)."
    },
    "duePayableAmount": {
      "type": "number",
      "description": "BT-115: Amount due for payment. Usually equals taxInclusiveAmount unless a prepaidAmount or roundingAmount is set."
    },
    "prepaidAmount": {
      "type": "number",
      "description": "BT-113: Prepaid amount (e.g. a prior down payment) deducted from this invoice. duePayableAmount = taxInclusiveAmount - prepaidAmount + roundingAmount."
    },
    "roundingAmount": {
      "type": "number",
      "description": "BT-114: Rounding amount added to the invoice total to round the amount due (may be negative, e.g. -0.01). duePayableAmount = taxInclusiveAmount - prepaidAmount + roundingAmount (BR-CO-16)."
    },
    "paymentMeans": {
      "type": "object",
      "additionalProperties": false,
      "required": ["code"],
      "properties": {
        "code": {
          "type": "string",
          "minLength": 1,
          "description": "BT-81: Payment means code (UNCL4461). 58 = SEPA credit transfer, 30 = credit transfer.",
          "maxLength": 500
        },
        "iban": {
          "type": "string",
          "pattern": "^[A-Z]{2}[0-9]{2}[A-Z0-9]{4,30}$",
          "description": "BT-84: Payment account identifier (IBAN)."
        },
        "accountName": {
          "type": "string",
          "description": "BT-85: Name of the account holder.",
          "maxLength": 10000
        },
        "bic": {
          "type": "string",
          "pattern": "^[A-Z]{4}[A-Z]{2}[A-Z0-9]{2}([A-Z0-9]{3})?$",
          "description": "BT-86: Payment service provider identifier (BIC/SWIFT)."
        }
      },
      "description": "BG-16: Payment means information."
    },
    "note": {
      "type": "string",
      "description": "BT-22: Free-text note on the invoice (e.g. payment terms prose).",
      "maxLength": 10000
    },
    "buyerReference": {
      "type": "string",
      "description": "BT-10: Buyer reference. For German public sector B2G invoices this must be the Leitweg-ID.",
      "maxLength": 500
    },
    "contractReference": {
      "type": "string",
      "description": "BT-12: Contract reference (Vertragsnummer).",
      "maxLength": 500
    },
    "purchaseOrderReference": {
      "type": "string",
      "description": "BT-13: Purchase order reference (Bestellnummer).",
      "maxLength": 500
    },
    "precedingInvoiceReference": {
      "type": "object",
      "additionalProperties": false,
      "required": ["id", "issueDate"],
      "properties": {
        "id": {
          "type": "string",
          "minLength": 1,
          "description": "BT-25: Preceding invoice number (for credit notes and corrective invoices).",
          "maxLength": 500
        },
        "issueDate": {
          "type": "string",
          "format": "date",
          "description": "BT-26: Issue date of the preceding invoice (YYYY-MM-DD)."
        }
      },
      "description": "BT-25 / BT-26: Reference to the invoice being corrected or credited."
    },
    "delivery": {
      "type": "object",
      "additionalProperties": false,
      "properties": {
        "actualDeliveryDate": {
          "type": "string",
          "format": "date",
          "description": "BT-72: Actual delivery or performance date (YYYY-MM-DD)."
        },
        "deliverTo": {
          "type": "object",
          "additionalProperties": false,
          "required": ["countryCode"],
          "properties": {
            "city": {
              "type": "string",
              "description": "BT-77: Deliver-to city.",
              "maxLength": 500
            },
            "postalCode": {
              "type": "string",
              "description": "BT-78: Deliver-to postal code.",
              "maxLength": 500
            },
            "countryCode": {
              "type": "string",
              "pattern": "^[A-Z]{2}$",
              "description": "BT-80: Deliver-to country code (ISO 3166-1 alpha-2). Required by BR-57 whenever a deliver-to address is supplied."
            }
          },
          "description": "BG-15: Deliver-to address."
        }
      },
      "description": "BG-13: Delivery information. BT-72 (or the unsupported BG-14 invoicing-period alternative) and BT-80 are required by BR-IC-11/BR-IC-12 when any VAT breakdown uses category 'K' (intra-EU supply)."
    }
  },
  "$defs": {
    "Party": {
      "type": "object",
      "additionalProperties": false,
      "required": ["name", "address", "electronicAddress"],
      "properties": {
        "name": {
          "type": "string",
          "minLength": 1,
          "description": "BT-27 / BT-44: Seller or buyer trading name. Required by §14 Abs. 4 Nr. 1/2 UStG.",
          "maxLength": 500
        },
        "legalId": {
          "type": "string",
          "description": "BT-30 / BT-47: Legal registration identifier (e.g. Handelsregisternummer HRB 12345).",
          "maxLength": 500
        },
        "vatId": {
          "type": "string",
          "pattern": "^[A-Z]{2}[0-9A-Z]{2,13}$",
          "description": "BT-31 / BT-48: VAT registration number (Umsatzsteuer-Identifikationsnummer). For the seller, required by §14 Abs. 4 Nr. 2 UStG when applicable. For the buyer, conditionally required by EN 16931 (e.g. BR-IC-02 for intra-EU supply, BR-AE-02 for reverse charge) rather than by Nr. 2, which concerns the seller's own tax number/VAT ID. German numbers start with DE."
        },
        "taxRegistrationId": {
          "type": "string",
          "description": "BT-32: Seller tax registration number (Steuernummer). Used by small businesses under §19 UStG who do not have a VAT ID.",
          "maxLength": 500
        },
        "address": {
          "$ref": "#/$defs/Address"
        },
        "electronicAddress": {
          "type": "string",
          "minLength": 1,
          "description": "BT-34 / BT-49: Electronic address for invoice routing (e.g. email address). Required by XRechnung.",
          "maxLength": 500
        },
        "electronicAddressSchemeId": {
          "type": "string",
          "description": "BT-34 / BT-49: Scheme identifier for the electronic address (e.g. EM for email, 9930 for German Leitweg-ID routing).",
          "maxLength": 500
        },
        "contact": {
          "$ref": "#/$defs/Contact",
          "description": "BG-6: Contact. Required on the seller for XRechnung (BR-DE-2)."
        }
      }
    },
    "Contact": {
      "type": "object",
      "additionalProperties": false,
      "required": ["telephone", "email"],
      "properties": {
        "name": {
          "type": "string",
          "description": "BT-41: Contact point (person or department name).",
          "maxLength": 500
        },
        "telephone": {
          "type": "string",
          "minLength": 1,
          "description": "BT-42: Contact telephone number.",
          "maxLength": 500
        },
        "email": {
          "type": "string",
          "format": "email",
          "description": "BT-43: Contact email address."
        }
      }
    },
    "Address": {
      "type": "object",
      "additionalProperties": false,
      "required": ["line1", "city", "postalCode", "countryCode"],
      "properties": {
        "line1": {
          "type": "string",
          "minLength": 1,
          "description": "BT-35 / BT-50: Address line 1 (street and house number). Required by §14 Abs. 4 Nr. 1/2 UStG.",
          "maxLength": 500
        },
        "line2": {
          "type": "string",
          "description": "BT-36 / BT-51: Address line 2 (optional).",
          "maxLength": 500
        },
        "city": {
          "type": "string",
          "minLength": 1,
          "description": "BT-37 / BT-52: City name.",
          "maxLength": 500
        },
        "postalCode": {
          "type": "string",
          "minLength": 1,
          "description": "BT-38 / BT-53: Postal code.",
          "maxLength": 500
        },
        "countryCode": {
          "type": "string",
          "pattern": "^[A-Z]{2}$",
          "description": "BT-40 / BT-55: Country code (ISO 3166-1 alpha-2, e.g. DE, FR)."
        }
      }
    },
    "InvoiceLine": {
      "type": "object",
      "additionalProperties": false,
      "required": [
        "id",
        "name",
        "quantity",
        "unitCode",
        "unitPrice",
        "lineAmount",
        "vatCategoryCode",
        "vatRate"
      ],
      "properties": {
        "id": {
          "type": "string",
          "minLength": 1,
          "description": "BT-126: Line identifier — unique within the invoice.",
          "maxLength": 500
        },
        "name": {
          "type": "string",
          "minLength": 1,
          "description": "BT-153: Item name. Required by §14 Abs. 4 Nr. 5 UStG.",
          "maxLength": 500
        },
        "description": {
          "type": "string",
          "description": "BT-154: Item description (optional free text).",
          "maxLength": 10000
        },
        "quantity": {
          "type": "number",
          "description": "BT-129: Invoiced quantity. Required by §14 Abs. 4 Nr. 5 UStG."
        },
        "unitCode": {
          "type": "string",
          "minLength": 1,
          "description": "BT-130: Unit of measure code (UN/ECE Recommendation 20). E.g. HUR = hours, C62 = each, KGM = kilograms.",
          "maxLength": 500
        },
        "unitPrice": {
          "type": "number",
          "description": "BT-146: Item net price per unit (before line-level discounts). Not limited to 2 decimal places, e.g. 0.0055 for a bulk per-piece price."
        },
        "lineAmount": {
          "type": "number",
          "description": "BT-131: Line net amount (quantity × unitPrice, after any line discounts)."
        },
        "vatCategoryCode": {
          "type": "string",
          "enum": ["S", "Z", "E", "AE", "K", "G", "O"],
          "description": "BT-151: VAT category code for this line. S=standard, Z=zero-rated, E=exempt, AE=reverse charge, K=intra-EU, G=export, O=not subject to VAT (§19)."
        },
        "vatRate": {
          "type": "number",
          "minimum": 0,
          "maximum": 100,
          "description": "BT-152: VAT rate as a percentage (e.g. 19, 7, 0). Required by §14 Abs. 4 Nr. 8 UStG."
        },
        "allowancesCharges": {
          "type": "array",
          "items": {
            "$ref": "#/$defs/AllowanceCharge"
          },
          "description": "BG-27 / BG-28: Line-level allowances (discounts) and charges (surcharges)."
        }
      }
    },
    "VatBreakdown": {
      "type": "object",
      "additionalProperties": false,
      "required": ["categoryCode", "rate", "taxableAmount", "taxAmount"],
      "properties": {
        "categoryCode": {
          "type": "string",
          "enum": ["S", "Z", "E", "AE", "K", "G", "O"],
          "description": "BT-118: VAT category code (see InvoiceLine.vatCategoryCode for values)."
        },
        "rate": {
          "type": "number",
          "minimum": 0,
          "maximum": 100,
          "description": "BT-119: VAT rate as a percentage."
        },
        "taxableAmount": {
          "type": "number",
          "description": "BT-116: Sum of line amounts subject to this VAT category."
        },
        "taxAmount": {
          "type": "number",
          "description": "BT-117: VAT amount for this category (taxableAmount × rate / 100)."
        },
        "exemptionReason": {
          "type": "string",
          "description": "BT-120: Textual reason for VAT exemption (required by §14 Abs. 4 UStG when applicable).",
          "maxLength": 10000
        },
        "exemptionReasonCode": {
          "type": "string",
          "description": "BT-121: Coded reason for VAT exemption (VATEX code list).",
          "maxLength": 500
        },
        "reverseChargeReason": {
          "type": "string",
          "enum": [
            "eu-cross-border-service",
            "foreign-supplier",
            "security-transfer",
            "real-estate",
            "construction",
            "gas-and-electricity",
            "emission-certificates",
            "scrap-and-waste",
            "cleaning",
            "qualifying-gold",
            "mobile-devices",
            "industrial-metals",
            "telecommunications"
          ],
          "description": "§13b UStG reverse-charge subcase (category 'AE' only). Internal only — not emitted to XML; VATEX has no per-subcase code."
        }
      }
    },
    "AllowanceCharge": {
      "type": "object",
      "additionalProperties": false,
      "required": ["amount", "isCharge"],
      "properties": {
        "amount": {
          "type": "number",
          "description": "BT-92/BT-99 (document) or BT-136/BT-141 (line): allowance or charge amount."
        },
        "isCharge": {
          "type": "boolean",
          "description": "UBL cbc:ChargeIndicator — false = allowance/discount (BG-20/BG-27), true = charge/surcharge (BG-21/BG-28)."
        },
        "reason": {
          "type": "string",
          "description": "BT-97/BT-104 (document) or BT-139/BT-144 (line): reason text.",
          "maxLength": 10000
        },
        "reasonCode": {
          "type": "string",
          "description": "BT-98/BT-105 (document) or BT-140/BT-145 (line): reason code.",
          "maxLength": 500
        },
        "vatCategoryCode": {
          "type": "string",
          "enum": ["S", "Z", "E", "AE", "K", "G", "O"],
          "description": "BT-95/BT-102: VAT category code. Document-level only — line-level allowances/charges inherit the line's own vatCategoryCode/vatRate instead."
        },
        "vatRate": {
          "type": "number",
          "minimum": 0,
          "maximum": 100,
          "description": "BT-96/BT-103: VAT rate as a percentage. Document-level only."
        }
      }
    }
  }
}
