{
  "id": "RE-2026-0046",
  "typeCode": "380",
  "issueDate": "2026-06-09",
  "dueDate": "2026-07-09",
  "currencyCode": "EUR",
  "businessProcessType": "urn:fdc:peppol.eu:2017:poacc:billing:01:1.0",
  "buyerReference": "04011000-12345-03",

  "seller": {
    "name": "Max Mustermann GmbH",
    "vatId": "DE123456789",
    "address": {
      "line1": "Unter den Linden 1",
      "city": "Berlin",
      "postalCode": "10117",
      "countryCode": "DE"
    },
    "electronicAddress": "rechnung@mustermann.example",
    "electronicAddressSchemeId": "EM",
    "contact": {
      "name": "Buchhaltung",
      "telephone": "+49 30 1234567",
      "email": "buchhaltung@mustermann.example"
    }
  },

  "buyer": {
    "name": "Acme GmbH",
    "vatId": "DE987654321",
    "address": {
      "line1": "Marienplatz 1",
      "city": "München",
      "postalCode": "80331",
      "countryCode": "DE"
    },
    "electronicAddress": "einkauf@acme.example",
    "electronicAddressSchemeId": "EM"
  },

  "lines": [
    {
      "id": "1",
      "name": "Seefracht-Charterleistung",
      "description": "Zero-rated Lieferung (Seeschifffahrt, §4 Nr. 2 UStG)",
      "quantity": 1,
      "unitCode": "C62",
      "unitPrice": 1000.0,
      "lineAmount": 1000.0,
      "vatCategoryCode": "Z",
      "vatRate": 0
    }
  ],

  "vatBreakdowns": [
    {
      "categoryCode": "Z",
      "rate": 0,
      "taxableAmount": 1000.0,
      "taxAmount": 0.0
    }
  ],

  "taxExclusiveAmount": 1000.0,
  "taxAmount": 0.0,
  "taxInclusiveAmount": 1000.0,
  "duePayableAmount": 1000.0,

  "paymentMeans": {
    "code": "58",
    "iban": "DE89370400440532013000",
    "accountName": "Max Mustermann GmbH",
    "bic": "COBADEFFXXX"
  },

  "note": "Zahlbar innerhalb von 30 Tagen nach Rechnungsdatum."
}
