{
  "id": "GS-2026-0012",
  "typeCode": "381",
  "issueDate": "2026-08-07",
  "dueDate": "2026-09-06",
  "currencyCode": "EUR",
  "businessProcessType": "urn:fdc:peppol.eu:2017:poacc:billing:01:1.0",
  "buyerReference": "04011000-12345-03",
  "precedingInvoiceReference": {
    "id": "RE-2026-0050",
    "issueDate": "2026-06-13"
  },
  "seller": {
    "name": "Max Mustermann GmbH",
    "vatId": "DE123456789",
    "address": {
      "line1": "Unter den Linden 1",
      "city": "Berlin",
      "postalCode": "10117",
      "countryCode": "DE"
    },
    "electronicAddress": "rechnung@mustermann.example",
    "electronicAddressSchemeId": "EM",
    "contact": {
      "name": "Buchhaltung",
      "telephone": "+49 30 1234567",
      "email": "buchhaltung@mustermann.example"
    }
  },
  "buyer": {
    "name": "Acme GmbH",
    "vatId": "DE987654321",
    "address": {
      "line1": "Marienplatz 1",
      "city": "München",
      "postalCode": "80331",
      "countryCode": "DE"
    },
    "electronicAddress": "einkauf@acme.example",
    "electronicAddressSchemeId": "EM"
  },
  "lines": [
    {
      "id": "1",
      "name": "TypeScript Consulting",
      "description": "Partial credit for invoice RE-2026-0050: 2 of 8 consulting hours not delivered as agreed",
      "quantity": 2,
      "unitCode": "HUR",
      "unitPrice": 125.0,
      "lineAmount": 250.0,
      "vatCategoryCode": "S",
      "vatRate": 19
    },
    {
      "id": "2",
      "name": "Fachliteratur",
      "description": "Full credit for invoice RE-2026-0050: technical books returned unused",
      "quantity": 5,
      "unitCode": "C62",
      "unitPrice": 20.0,
      "lineAmount": 100.0,
      "vatCategoryCode": "S",
      "vatRate": 7
    }
  ],
  "vatBreakdowns": [
    {
      "categoryCode": "S",
      "rate": 19,
      "taxableAmount": 250.0,
      "taxAmount": 47.5
    },
    {
      "categoryCode": "S",
      "rate": 7,
      "taxableAmount": 100.0,
      "taxAmount": 7.0
    }
  ],
  "taxExclusiveAmount": 350.0,
  "taxAmount": 54.5,
  "taxInclusiveAmount": 404.5,
  "duePayableAmount": 404.5,
  "paymentMeans": {
    "code": "58",
    "iban": "DE89370400440532013000",
    "accountName": "Max Mustermann GmbH",
    "bic": "COBADEFFXXX"
  },
  "note": "Teilgutschrift zu Rechnung RE-2026-0050 vom 13.06.2026: 2 nicht erbrachte Beratungsstunden (Position 1) und vollständige Rückgabe der Fachliteratur (Position 2, ermäßigter Steuersatz). (positive Beträge)"
}
