{
  "id": "RE-2026-0105",
  "typeCode": "380",
  "issueDate": "2026-08-08",
  "dueDate": "2026-08-22",
  "currencyCode": "EUR",
  "businessProcessType": "urn:fdc:peppol.eu:2017:poacc:billing:01:1.0",
  "buyerReference": "04011000-12345-03",

  "seller": {
    "name": "Max Mustermann GmbH",
    "vatId": "DE123456789",
    "address": {
      "line1": "Unter den Linden 1",
      "city": "Berlin",
      "postalCode": "10117",
      "countryCode": "DE"
    },
    "electronicAddress": "rechnung@mustermann.example",
    "electronicAddressSchemeId": "EM",
    "contact": {
      "name": "Buchhaltung",
      "telephone": "+49 30 1234567",
      "email": "buchhaltung@mustermann.example"
    }
  },

  "buyer": {
    "name": "Acme GmbH",
    "vatId": "DE987654321",
    "address": {
      "line1": "Marienplatz 1",
      "city": "München",
      "postalCode": "80331",
      "countryCode": "DE"
    },
    "electronicAddress": "einkauf@acme.example",
    "electronicAddressSchemeId": "EM"
  },

  "lines": [
    {
      "id": "1",
      "name": "Anzahlung: Großbestellung Fachliteratur",
      "description": "Anzahlung (30% des Auftragswerts) gemäß Vertrag VERTRAG-2026-0300 für die Lieferung gebundener Fachbücher, ermäßigter Steuersatz gem. §12 Abs. 2 Nr. 1 UStG i.V.m. Anlage 2 UStG",
      "quantity": 1,
      "unitCode": "C62",
      "unitPrice": 3000.0,
      "lineAmount": 3000.0,
      "vatCategoryCode": "S",
      "vatRate": 7
    }
  ],

  "vatBreakdowns": [
    {
      "categoryCode": "S",
      "rate": 7,
      "taxableAmount": 3000.0,
      "taxAmount": 210.0
    }
  ],

  "taxExclusiveAmount": 3000.0,
  "taxAmount": 210.0,
  "taxInclusiveAmount": 3210.0,
  "duePayableAmount": 3210.0,

  "paymentMeans": {
    "code": "58",
    "iban": "DE89370400440532013000",
    "accountName": "Max Mustermann GmbH",
    "bic": "COBADEFFXXX"
  },

  "note": "Anzahlungsrechnung gemäß Vertrag VERTRAG-2026-0300: 30% des Gesamtauftragswerts von EUR 10.000,00 netto, ermäßigter Steuersatz (7%) gem. §12 Abs. 2 Nr. 1 UStG für die Lieferung gebundener Fachbücher. Die Schlussrechnung wird diesen Betrag als Anzahlung berücksichtigen."
}
