{
  "id": "RE-2026-0043",
  "typeCode": "380",
  "issueDate": "2026-06-09",
  "dueDate": "2026-07-09",
  "currencyCode": "EUR",
  "businessProcessType": "urn:fdc:peppol.eu:2017:poacc:billing:01:1.0",
  "buyerReference": "04011000-12345-03",
  "purchaseOrderReference": "PO-2026-0042",

  "seller": {
    "name": "Max Mustermann GmbH",
    "vatId": "DE123456789",
    "address": {
      "line1": "Unter den Linden 1",
      "city": "Berlin",
      "postalCode": "10117",
      "countryCode": "DE"
    },
    "electronicAddress": "rechnung@mustermann.example",
    "electronicAddressSchemeId": "EM",
    "contact": {
      "name": "Buchhaltung",
      "telephone": "+49 30 1234567",
      "email": "buchhaltung@mustermann.example"
    }
  },

  "buyer": {
    "name": "Acme GmbH",
    "vatId": "DE987654321",
    "address": {
      "line1": "Marienplatz 1",
      "city": "München",
      "postalCode": "80331",
      "countryCode": "DE"
    },
    "electronicAddress": "einkauf@acme.example",
    "electronicAddressSchemeId": "EM"
  },

  "lines": [
    {
      "id": "1",
      "name": "TypeScript Consulting",
      "description": "Software architecture consulting, June 2026",
      "quantity": 8,
      "unitCode": "HUR",
      "unitPrice": 125.00,
      "lineAmount": 1000.00,
      "vatCategoryCode": "S",
      "vatRate": 19
    },
    {
      "id": "2",
      "name": "Code Review",
      "description": "Pull request and architecture review",
      "quantity": 2,
      "unitCode": "HUR",
      "unitPrice": 95.00,
      "lineAmount": 190.00,
      "vatCategoryCode": "S",
      "vatRate": 19
    },
    {
      "id": "3",
      "name": "Development Tools License",
      "description": "Annual IDE plugin license, prorated",
      "quantity": 1,
      "unitCode": "C62",
      "unitPrice": 49.00,
      "lineAmount": 49.00,
      "vatCategoryCode": "S",
      "vatRate": 19
    }
  ],

  "vatBreakdowns": [
    {
      "categoryCode": "S",
      "rate": 19,
      "taxableAmount": 1239.00,
      "taxAmount": 235.41
    }
  ],

  "taxExclusiveAmount": 1239.00,
  "taxAmount": 235.41,
  "taxInclusiveAmount": 1474.41,
  "duePayableAmount": 1474.41,

  "paymentMeans": {
    "code": "58",
    "iban": "DE89370400440532013000",
    "accountName": "Max Mustermann GmbH",
    "bic": "COBADEFFXXX"
  },

  "note": "Zahlbar innerhalb von 30 Tagen nach Rechnungsdatum."
}
